Category,Market,Brand,Product ,Ingredient List 
SPF,AU,BondiSands,Fragrance Free Body lotion SPF 50,"Homosalate (10.00%), Octocrylene (8.00%), Octyl Salicylate (5.00%), Butyl Methoxydibenzoylmethane (3.00%), Phenoxyethanol, Benzyl Alcohol
"
SPF,DE,DM,Sun Dance Ultra sensitive Gel creme SPF 50,"Aqua, Alcohol Denat., Dibutyl Adipate, Diethylamino Hydroxybenzoyl Hexyl Benzoate, Glycerin, C12-15 Alkyl Benzoate, Ethylhexyl Salicylate, Diethylhexyl Butamido Triazone, Propylheptyl Caprylate, VP/Hexadecene Copolymer, Bis-Ethylhexyloxyphenol Methoxyphenyl Triazine, Triacontanyl PVP, Phenylbenzimidazole Sulfonic Acid, Tocopheryl Acetate, Acrylates Copolymer, Microcrystalline Cellulose, Caprylyl Glycol, Sodium Hydroxide, Galactoarabinan, Disodium EDTA, Ethylhexylglycerin, Cellulose Gum, Acrylates/C10-30 Alkyl Acrylate Crosspolymer, Citric Acid, Tocopherol."
SPF,DE,DM,Balea Niacinamide 10% moisturizer SPF 30,"AQUA, NIACINAMIDE, DIBUTYL ADIPATE, GLYCERIN, ETHYLHEXYL SALICYLATE, BUTYL METHOXYDIBENZOYLMETHANE , DIISOPROPYL SEBACATE, PHENYLBENZIMIDAZOLE SULFONIC ACID, C12-15 ALKYL BENZOATE, BIS-ETHYLHEXYLOXYPHENOL METHOXYPHENYL TRIAZINE, CETEARYL ALCOHOL, GLYCERYL STEARATE CITRATE, ETHYLHEXYL TRIAZONE, PANTHENOL, SCLEROTIUM GUM, SODIUM STEAROYL GLUTAMATE, PROPYLENE GLYCOL, GLYCYRRHIZA GLABRA ROOT EXTRACT, SORBITOL , TETRASODIUM EDTA, SODIUM HYDROXIDE, CITRIC ACID, CAPRYLYL GLYCOL, ETHYLHEXYLGLYCERIN, PHENOXYETHANOL."
SPF,DE,DM ,Alverde Clear Beauty Getonte tagescreme ,"Aqua, Olea Europaea Fruit Oil*, CI 77891, Alcohol* denat., Glycerin, Zinc Oxide, Carthamus Tinctorius Seed Oil*, Prunus Amygdalus Dulcis Oil*, Cetearyl Olivate, Butyrospermum Parkii Butter*, Lauryl Laurate, Sorbitan Olivate, Tricaprylin, Camellia Sinensis Leaf Extract*, Centella Asiatica Leaf Extract, Bambusa Arundinacea Stem Powder, CI 77492, CI 77499, Dehydroxanthan Gum, Cetearyl Alcohol, CI 77491, Silica, CI 75810, Stearic Acid, Tocopherol, Helianthus Annuus Seed Oil*, Ascorbyl Palmitate, Parfum**, Limonene**, Linalool**, Benzyl Salicylate**, Citral**, Geraniol** *ingredients from certified organic agriculture **from natural essential oils"
SPF,DE,Eucerin,Sun Oil Control ,"Aqua, Homosalate, Polymethylsilsesquioxane, Butyl Methoxydibenzoylmethane, Ethylhexyl Salicylate, Octocrylene, Alcohol Denat, Tapioca Starch, Phenylbenzimidazole Sulfonic Acid, Cyclomethicone, Behenyl Alcohol, Cetearyl Alcohol, Methylpropanediol, Silica Dimethyl Silylate, Glycerin, Carnitine, Acid Gliciretinic, Glycyrrhiza Inflata Root Extract, Sodium Stearoyl Glutamate, Acrylates-C10-30-Alkyl-Acrylate-Crosspolymer, Carbomer, Xanthan Gum, Sodium Hydroxide, Sodium Chloride, Trisodium EDTA, Ethylhexylglycerin, Phenoxyethanol
"
SPF,DE,JeanLen,Sensitive Face SPF 50,"Aqua, C12-15 Alkyl Benzoate, Glycerin, Diethylamino Hydroxybenzoyl Hexyl Benzoate, Ethylhexyl Salicylate, Titanium Dioxide (Nano), Octyldodecanol, Dibutyl Adipate, Alcohol Denat, Cetearyl Alcohol, Diethylhexyl Butamido Triazone, Glyceryl Stearate Citrate, Glyceryl Stearate SE, Tapioca Starch, Tocopheryl Acetate, Helianthus Annuus Seed Cera, Caprylyl Glycol, Aluminum Hydroxide, Stearic Acid, Glyceryl Rosinate, Bis-Ethylhexyloxyphenol Methoxyphenyl Triazine, Polyglyceryl-2 Sesquiisostearate, Sodium Cetearyl Sulfate, Xanthan Gum, Phenylbenzimidazole Sulfonic Acid, Acacia Senegal Gum, Sclerotium Gum, Disodium EDTA, Disodium Phosphate, Caprylhydroxamic Acid, Sodium Hydroxide, Potassium Phosphate, Ascorbyl Palmitate, Tocopherol, Helianthus Annuus Seed Oil
"
SPF,DE,Nivea,Beruhigende Tagespflege 24H LSF 15,"Aqua, Glycerin, Ethylhexyl Salicylate, C12-15 Alkyl Benzoate, Methylpropanediol, Cetearyl Alcohol, Butyl Methoxydibenzoylmethane, Caprylic/Capric Triglyceride, Glyceryl Stearate, Tapioca Starch, Hydroxypropyl Starch Phosphate, Bis-Ethylhexyloxyphenol Methoxyphenyl Triazine, Distarch Phosphate, Glycyrrhiza Inflata Root Extract, Vitis Vinifera Seed Oil, Sodium Stearoyl Glutamate, Butyrospermum Parkii Butter, Ethylhexylglycerin, Hydroxyacetophenone, Xanthan Gum, Phenylbenzimidazole Sulfonic Acid, Trisodium EDTA, Sodium Chloride, Sodium Hydroxide, Phenoxyethanol"
SPF,DE,Nivea ,Sensitive protect SPF 30,"Aqua, Homosalate, Alcohol Denat., Butyl Methoxydibenzoylmethane, Ethylhexyl Salicylate, Butylene Glycol Dicaprylate/Dicaprate, Bis-Ethylhexyloxyphenol Methoxyphenyl Triazine, Ethylhexyl Triazone, Isopropyl Palmitate, Phenylbenzimidazole Sulfonic Acid, Silica, Tapioca Starch, Diethylamino Hydroxybenzoyl Hexyl Benzoate, Behenyl Alcohol, Cetearyl Alcohol, Methylpropanediol, Glycerin, Glycyrrhiza Inflata Root Extract, Tocopheryl Acetate, Sodium Stearoyl Glutamate, Xanthan Gum, Carbomer, Acrylates/C10-30 Alkyl Acrylate Crosspolymer, Sodium Chloride, Sodium Hydroxide, Dimethicone, Trisodium EDTA, Caprylyl Glycol, Ethylhexylglycerin"
SPF,DE,Nivea ,Sensitive Face SPF 50,"Aqua, Alcohol Denat., Butyl Methoxydibenzoyl methane, Ethylhexyl Triazone, Bis-Ethylhexyloxyphenol Me thoxyphenyl Triazine, Isopropyl Palmitate, C12-15 Alkyl Benzoate, Dibutyl Adipate, Butylene Glycol Dicaprylate/Dicaprate, Di ethylamino Hydroxybenzoyl Hexyl Benzoate, Glyceryl Stearate, Glycerin, Phenylbenzimidazole Sulfonic Acid, Glycyrrhiza Inflata Root Extract, Aloe Barbadensis Leaf Juice Powder, Tocopheryl Acetate, Microcrystalline Cellulose, Cellulose Gum, C18-38 Alkyl Hydroxystearoyl Stearate, Copernicia Cerifera Cera, Hydroge nated Rapeseed Oil, Cetyl Palmitate, Xanthan Gum, Sodium Stearoyl Glutamate, Sodium Hydroxide, Sodium Chloride, Caprylyl Glycol, Ethylhexylglycerin, Trisodium EDTA"
SPF,DE,Nivea ,Sensitive Shine Control Face SPF 50,"Aqua, Homosalate, Butyl Methoxydibenzoylmethane, Ethylhexyl Salicylate, Butylene Glycol Dicaprylate/Dicaprate, Alcohol Denat., Bis-Ethylhexyloxyphenol Methoxyphenyl Triazine, Ethylhexyl Triazone, Isopropyl Palmitate, Phenylbenzimidazole Sulfonic Acid, Silica, Tapioca Starch, Diethylamino Hydroxybenzoyl Hexyl Benzoate, Behenyl Alcohol, Cetearyl Alcohol, Methylpropanediol, Glycerin, Glycyrrhiza Inflata Root Extract, Tocopheryl Acetate, Sodium Stearoyl Glutamate, Xanthan Gum, Carbomer, Acrylates/C10-30 Alkyl Acrylate Crosspolymer, Dimethicone, Sodium Chloride, Sodium Hydroxide, Trisodium EDTA, Ethylhexylglycerin, Phenoxyethanol, Linalool, Limonene, Benzyl Alcohol, Alpha-Isomethyl Ionone, Geraniol, Citronellol, Coumarin, Parfum"
SPF,DE,Nivea ,Anti Falten Q10 Poren LSF 15 ,"Aqua, Ethylhexyl Salicylate, Octocrylene, Glycerin, Butyl Methoxydibenzoylmethane, Cetearyl Alcohol, Dimethicone, Methylpropanediol, Glyceryl Stearate Citrate, Phenylbenzimidazole Sulfonic Acid, Ubiquinone, Creatine, 1-Methylhydantoin-2-Imide, Fucus Vesiculosus Extract, Tocopherol, Caprylic/Capric Triglyceride, Dicaprylyl Carbonate, Caprylyl Glycol, 1,2-Hexanediol, Tapioca Starch, Carbomer, Acrylates/C10-30 Alkyl Acrylate Crosspolymer, Sodium Sulfate, Trisodium EDTA, Sodium Hydroxide, Phenoxyethanol, Limonene, Linalool, Benzyl Alcohol, Alpha-Isomethyl Ionone, Geraniol, Parfum, CI 42090"
SPF,DE,ROSSMAN,Sun OZone AlgenExtract SPF 50,"Aqua, Glycerin, C12-15 Alkyl Benzoate, Diethylamino Hydroxybenzoyl Hexyl Benzoate, Diisopropyl Adipate, Ethylhexyl Triazone, Propanediol Dicaprylate/Caprate, Bis-Ethylhexyloxyphenol, Methoxyphenyl Triazine, Potassium Cetyl Phosphate, Myristyl Alcohol, Phenoxyethanol, Xanthan Gum, Phenylbenzimidazole Sulfonic Acid, Tocopheryl Acetate, Parfum, Sclerotium Gum, Potassium Hydroxide, Acacia Senegal Gum, Caprylhydroxamic Acid, Butylene Glycol, Codium Tomentosum Extract"
SPF,DE,ROSSMAN,Sun Ozone Med Gel SPF 20 ,Aqua | Octocrylene | C12-15 Alkyl Benzoate | Glycerin | Ethylhexyl Salicylate | Butyl Methoxydibenzoylmethane | Titanium Dioxide (nano) | Acrylates Copolymer | Tocopheryl Acetate | Carnosine | Dimethicone | VP/Hexadecene Copolymer | Phenylbenzimidazole Sulfonic Acid | Silica | Hydrogen Dimethicone | Acrylates/C10-30 Alkyl Acrylate Crosspolymer | Caprylyl Glycol | Caprylhydroxamic Acid | Sodium Hydroxide | Tetrasodium EDTA
SPF,DE,ROSSMAN,Sun OZone Anti Aging SPF 50,"Aqua, Glycerin, C12-15 Alkyl Benzoate, Diethylamino Hydroxybenzoyl Hexyl Benzoate, Propanediol Dicaprylate/​Caprate, Diisopropyl Adipate, Ethylhexyl Triazone, Bis-Ethylhexyloxyphenol Methoxyphenyl Triazine, Potassium Cetyl Phosphate, Myristyl Alcohol, Phenoxyethanol, Xanthan Gum, Phenylbenzimidazole Sulfonic Acid, Tocopheryl Acetate, Parfum, Potassium Hydroxide, Sclerotium Gum, Acacia Senegal Gum, Caprylhydroxamic Acid, Sodium Hyaluronate, Ubiquinone, Limonene"
SPF,DE,ROSSMAN,Sun OZone Med fluid SPF 30,"Aqua, Glycerin, C12-15 Alkyl Benzoate, Diethylamino Hydroxybenzoyl Hexyl Benzoate, Diisopropyl Adipate, Ethylhexyl Triazone, Propanediol Dicaprylate/Caprate, Bis-Ethylhexyloxyphenol Methoxyphenyl Triazine, Potassium Cetyl Phosphate, Myristyl Alcohol, Phenoxyethanol, Xanthan Gum, Phenylbenzimidazole Sulfonic Acid, Tocopheryl Acetate, Potassium Hydroxide, Sclerotium Gum, Acacia Senegal Gum, Caprylhydroxamic Acid."
SPF,DE,ROSSMAN,ISANA HA Moisturizer SPF 30,"Aqua, C12-15 Alkyl Benzoate, Glycerin, Butyl Methoxydibenzoylmethane, EthylhexylTriazone, Phenylbenzimidazole Sulfonic Acid, Arginine, Cetyl Alcohol, Cocoglycerides, PotassiumCetyl Phosphate, Bis-Ethylhexyloxyphenol Methoxyphenyl Triazine, Hydrogenated Palm Glycerides,Coco-Caprylate, Hydrogenated Vegetable Glycerides, Sesamum Indicum Seed Oil, TocopherylAcetate, Vitis Vinifera Seed Oil, Sodium Hyaluronate, Helianthus Annuus Seed Oil, Tocopherol,Sodium Chondroitin Sulfate, Atelocollagen, Phenoxyethanol, Panthenol, Pentaerythrityl Tetraisostearate,Ethylhexylglycerin, Xanthan Gum, Parfum, Sclerotium Gum, Disodium Edta, SilicaDimethyl Silylate, Linalool, Butylene Glycol, Limonene, Pantolactone, Benzyl Alcohol, BenzylSalicylate, Caprylyl Glycol, Hexylene Glycol, Alpha-Isomethyl Ionone, Citronellol, Citric Acid"
SPF,DE,Sebamed ,Anti Rotung LSF 20,"Aqua, Glycerin, Dibutyl Adipate, Dicaprylyl Ether, Propylheptyl Caprylate, Methylene Bis-Benzotriazolyl Tetramethylbutylphenol (Nano), Sodium Carboxymethyl Starch, Tris-Biphenyl Triazine (Nano), Zea Mays Starch, Cetearyl Alcohol, Ethylhexyl Triazone, Bis-Ethylhexyloxyphenol Methoxyphenyl Triazine, Tocopheryl Acetate, Butyrospermum Parkii Butter, Ethylhexyl Stearate, Glyceryl Stearate, Disodium Cetearyl Sulfosuccinate, 1,2-Hexanediol, Physalis Pubescens Fruit Juice, Centella Asiatica Leaf Extract, Diethylhexyl Syringylidenemalonate, 4-T-Butylcyclohexanol, Pentylene Glycol, Tocopherol, Allantoin, Caprylic/​Capric Triglyceride, Decyl Glucoside, Propylene Glycol, Butylene Glycol, Hydroxypropyl Methylcellulose, Xanthan Gum, Sodium Chloride, Disodium Phosphate, Citric Acid, Sodium Hydroxide, Sorbic Acid, Benzyl Alcohol, Ci 47005, Ci 61570
"
SPF,FR,Garnier ,BB oily/combo skin tinted SPF 25 ,"Aqua/​Water, Dimethicone, Alcohol Denat, Titanium Dioxide [Nano], Titanium Dioxide, Butylene Glycol, Isododecane, PEG-10 Dimethicone, Phenyl Trimethicone, Bis-PEG/​PPG-14/​14 Dimethicone, Squalane, Synthetic Fluorphlogopite, Parfum/​Fragrance, Magnesium Sulfate, Aluminum Hydroxide, Stearic Acid, Maltitol, Tocopheryl Acetate, Disodium Stearoyl Glutamate, Aloe Barbadensis Leaf Juice Powder, Ascorbyl Glucoside, Citrus Grandis Fruit Water/​Grapefruit Fruit Water, Linalool, Benzyl Salicylate, Limonene, Benzyl Alcohol, Sorbitol, Sodium Hyaluronate, Perlite, Geraniol, Citral
May Contain: Ci 77891/​Titanium Dioxide, Ci 77491, Ci 77492, Ci 77499/​Iron Oxides
"
SPF,FR,Garnier,Ambre Solaire Anti Aging SPF ,"Aqua/​Water, C12-15 Alkyl Benzoate, Glycerin, Octocrylene, Niacinamide, Butyl Methoxydibenzoylmethane, Dimethicone, Ethylhexyl Triazone, Silica, Aluminum Starch Octenylsuccinate, Vinyl Dimethicone/​Methicone Silsesquioxane Crosspolymer, Terephthalylidene Dicamphor Sulfonic Acid, Potassium Cetyl Phosphate, Drometrizole Trisiloxane, PEG-100 Stearate, Stearyl Alcohol, Glyceryl Stearate, Tocopherol, Hydroxyacetophenone, Hydrolyzed Hyaluronic Acid, Phenylethyl Resorcinol, Triethanolamine, Trisodium Ethylenediamine Disuccinate, Poloxamer 338, Ammonium Polyacryloyldimethyl Taurate, Xanthan Gum, Caprylyl Glycol, Capryloyl Salicylic Acid (Fll C259134/​2)
"
SPF,FR,Garnier ,Ambre Solaire SUper UV Fluid,"Aqua/​Water, Alcohol Denat, Diisopropyl Sebacate, Silica, Isopropyl Myristate, Ethylhexyl Salicylate, Ethylhexyl Triazone, Bis-Ethylhexyloxyphenol Methoxyphenyl Triazine, Butyl Methoxydibenzoylmethane, Glycerin, C12-22 Alkyl Acrylate/​Hydroxyethylacrylate Copolymer, Propanediol, Drometrizole Trisiloxane, Perlite, Caprylic/​Capric Triglyceride, Tocopherol, Hydroxyacetophenone, Hydroxyethylcellulose, Sodium Hyaluronate, Thermus Thermophillus Ferment, Phenoxyethanol, Triethanolamine, Trisodium Ethylenediamine Disuccinate, Caprylyl Glycol, Terephthalylidene Dicamphor Sulfonic Acid, Acrylates/​C10-30 Alkyl Acrylate Crosspolymer, Potassium Sorbate
"
SPF,FR,Garnier,Vitamin C Serum creme SPF 25,"Aqua/​Water, Glycerin, Ethylhexyl Salicylate, Dimethicone, Phenylbenzimidazole Sulfonic Acid, Bis-Ethylhexyloxyphenol Methoxyphenyl Triazine, Triethanolamine, Butyl Methoxydibenzoylmethane, Octyldodecanol, Isopropyl Isostearate, Cetyl Alcohol, Behenyl Alcohol, Citrus Limon Fruit Extract/​Lemon Fruit Extract, Citrus Paradisi Fruit Extract/​Grapefruit Fruit Extract, Tin Oxide, Stearic Acid, Titanium Dioxide, Cetearyl Alcohol, Cetearyl Glucoside, PEG-100 Stearate, Sodium Hyaluronate, Sodium Polyacrylate Starch, Sodium Stearoyl Glutamate, Silica, Myristic Acid, Palmitic Acid, Adenosine, Ascorbyl Glucoside, Hydroxyacetophenone, Capryloyl Salicylic Acid, Citric Acid, Trisodium Ethylenediamine Disuccinate, Poly C10-30 Alkyl Acrylate, Chlorphenesin, Mica, Ci 77891/​Titanium Dioxide, Linalool, Geraniol, Limonene, Citronellol, Parfum/​Fragrance
"
SPF,FR,La Roche Posay,Anthelios Invisible Fluid,"Aqua/​Water, Alcohol Denat, Diisopropyl Sebacate, Silica, Isopropyl Myristate, Ethylhexyl Salicylate, Ethylhexyl Triazone, Bis-Ethylhexyloxyphenol Methoxyphenyl Triazine, Butyl Methoxydibenzoylmethane, Glycerin, C12-22 Alkyl Acrylate/​Hydroxyethylacrylate Copolymer, Propanediol, Drometrizole Trisiloxane, Perlite, Tocopherol, Caprylic/​Capric Triglyceride, Acrylates/​C10-30 Alkyl Acrylate Crosspolymer, Caprylyl Glycol, Hydroxyethylcellulose, Terephthalylidene Dicamphor Sulfonic Acid, Triethanolamine, Trisodium Ethylenediamine Disuccinate, Parfum/​Fragrance
"
SPF,FR,La Roche Posay,Anthelios SPF 50,"Aqua/Water, Homosalate, CI 77891 / Titanium Dioxide, Silica, Ethylhexyl Salicylate, Ethylhexyl Riazone, C12-15 Alkyl Benzoate, BIS-Ethylhexyloxyphenol Methoxyphenyl Triazine, Drometrizole Trisiloxane, Butyl Methoxydibenzoylmethane, Octocrylene, Styrene/Acrylates Copolymer, Titanium Dioxide [Nano] / Titanium Dioxide, Aluminum Starch Octenylsuccinate, C1 77491, C1 77492, C1 77499 / Iron Oxides, Potassium Cetyl Phosphate, Methylene BIS-Benzotriazolyl Tetramethylbutyphenol [Nano] // Methylene Bis-Benzotriazolyl Tetramethylbutylphenol, Propylene Glycol, Caprylyl Methicone, Pentylene Glycol, Acrylates/C10-30 Alkyl Acrylate Crosspolymer, Aluminum Hydroxide, Butylene Glycol, Caprylyl Glycol, Dimethicone, Disodium EDTA, Glycerin, Inulin Lauryl Carbamate, PEG-8 Laurate, Phenoxyethanol Acid, Stearyl Alcohol, Terephthalylidene Triethanolamine, Xanthan Gum"
SPF,FR,La Roche Posay,Anthelios Shaka Fluid sensitive Tinted SPF 50,"Aqua/​Water, Alcohol Denat, Diisopropyl Sebacate, Silica, Isopropyl Myristate, Ethylhexyl Salicylate, Ethylhexyl Triazone, Bis-Ethylhexyloxyphenol Methoxyphenyl Triazine, Butyl Methoxydibenzoylmethane, Glycerin, C12-22 Alkyl Acrylate/​Hydroxyethylacrylate Copolymer, Propanediol, Drometrizole Trisiloxane, Ci 77891/​Titanium Dioxide, Perlite, Tocopherol, Caprylic/​Capric Triglyceride, Acrylates/​C10-30 Alkyl Acrylate Crosspolymer, Caprylyl Glycol, Ci 77491, Ci 77492, Ci 77499/​Iron Oxides, Hydroxyethylcellulose, Terephthalylidene Dicamphor Sulfonic Acid, Triethanolamine, Trisodium Ethylenediamine Disuccinate, Parfum/​Fragrance
"
SPF,JP,Nivea Japan,Aqua Gel,"Water, Ethylhexyl Methoxycinnamate, Ethanol, Pg, Dimethicone, Ethylhexyl Triazone, Hexyl Diethylaminohydroxybenzoylbenzoate, Sodium Hyaluronate, Phellodendron Bark Extract, Quince Seed Extract, Tocopherol Acetate, Acrylates /​ Alkyl Acrylate C10-30 Crosspolymer, Carbomer, Ceteth-10, Na Hydroxide, BHT, Methylparaben
"
SPF,JP,Rotho Mentolatum ,Skin Aqua Super Moisture Gel SPF 50,"Water, Alcohol, Ethylhexyl Methoxycinnamate, Phenylbenzimidazole Sulfonic Acid, Diethylamino Hydroxybenzoyl Hexyl Benzoate, Isoamyl p-Methoxycinnamate, Dimethicone, Butylene Glycol Dicaprylate/​Dicaprate, Diethylhexyl Sebacate, Arachidyl Alcohol, Silica, Ethylhexyl Triazone, Disodium Phenyl Dibenzimidazole Tetrasulfonate, Butylene Glycol, Portulaca Oleracea Extract, Sodium Hydroxide, Phenoxyethanol, Behenyl Alcohol, Sodium Citrate, Polysorbate 60, Diethylhexyl Butamido Triazone, Arachidyl Glucoside, Methylene Bis-Benzotriazolyl Tetramethylbutylphenol, Tremella Fuciformis Polysaccharide, Bis-Ethylhexyloxyphenol Methoxyphenyl Triazine, Xanthan Gum, Fragrance, Ethylhexylglycerin, Disodium EDTA, Decyl Glucoside, Citric Acid, Sodium Ascorbyl Phosphate, Propylene Glycol, Hydrolyzed Sodium Hyaluronate, Ectoin, Carnosine, Theobroma Cacao (Cocoa) Seed Extract

"
SPF,JP,Kose,Suncut UV Perfect Gel Super water proof spf 50,"Water, Ethanol, Ethylhexyl Methoxycinnamate, Isododecane, Polysilicone-15, Silica, Hexyl Diethylaminohydroxybenzoylbenzoate, Bisethylhexyloxyphenol Methoxyphenyl Triazine, DPG, Chamomile Flower Extract, Clematis Vitalba Leaf Extract, Camphor Extract, Horsetail Extract, Hypericum Perforatum Flower/​Leaf/​Stem Extract, Astragalus Membranaceus Extract, Calendula Officinalis Flower Extract, Hyaluronic Acid Na, Chrysanthemum Parthenium Extract, Cornflower Flower Extract, Aroma, Chamomile Flower Extract, Brown Algae Extract, Water-Soluble Collagen, BG, BHT, EDTA 2Na, PEG -10 Hydrogenated Castor Oil, PEG-40 Hydrogenated Castor Oil, Tea, (Acrylic Acid/​Alkyl Acrylate (C10-30)) Copolymer, Acrylates Copolymer, Xanthan Gum, Capric Acid, Pg, Silica Dimethyl Silylate, Squalane, Stearic Acid, Inulin, Polyhydroxystearic Acid, Phenoxyethanol, Methylparaben
"
SPF,JP,Omi Verdio,Gel Moisturizer SPF 50,"Water, BG, ethylhexyl methoxycinnamate, hydrogenated polyisobutene, cetyl ethylhexanoate, diethylaminohydroxybenzoyl hexyl benzoate, titanium oxide, silica, cotton seed extract, tea leaf extract, aubergine root extract, horseradish seed extract, aloe vera leaf extract, Glycerin, PEG-12 dimethicone, ethylhexyl triazone, bisethylhexyl oxyphenol methoxyphenyl triazine, stearyl dimethicone, triethoxy caprylylsilane, (acrylic acid Na / acryloyl dimethyl taurine Na) copolymer, aluminum hydroxide, polyglyceryl distearate-3 Methyl glucose, tocopherol acetate, xanthan gum, isohexadecane, hydrous silica, polysorbate 80, sorbitan oleate, tocopherol, 2Na phosphate, cu Phosphate, BHT, phenoxyethanol"
SPF,JP,Kiss Me Mommy,Mild SPF Gel ,"Water, Propylene Glycol, Ethylhexyl Methoxycinnamate, Macadamia Ternifolia Seed Oil, Diethylamino Hydroxybenzoyl Hexyl Benzoate, Trehalose, Sodium Hyaluronate, Simmondsia Chinensis (Jojoba) Seed Oil, Malpighia Glabra (Acerola) Fruit Extract, Aloe Barbadensis Leaf Extract, Rubus Idaeus (Raspberry) Fruit Extract, Acrylates/​C10-30 Alkyl Acrylate Crosspolymer, Polyglyceryl-10 Stearate, Potassium Hydroxide, Disodium EDTA, BHT, Butylene Glycol
"
SPF,JP,kao,Biore UV Aqua Rich Light up essence ,"Water, Ethylhexyl Methoxycinnamate, Ethanol, BG, Isopropyl Palmitate, Titanium Oxide, Bisethylhexyloxyphenol Methoxyphenyl Triazine, Ethylhexyl Triazone, Dimethicone Crosspolymer (Lauryl Methacrylate /​ Na Methacrylate), Hydrogenated Polyisobutene, Diethylamino Hydroxybenzoyl Hexyl Benzoate, Silica, Hydrous Silica, Mica, Dextrin Palmitate, Dipentaerythrityl Tri-Polyhydroxystearate, Acrylates /​ Alkyl Acrylate C10-30 Crosspolymer, Triethoxycaprylylsilane, Cetanol, Glyceryl Stearate, Hydroxyethyl Cellulose, Polysorbate 60, Polysilicone-9, Al Hydroxide, K Hydroxide, Royal Jelly Extract, Na Hyaluronate, Tin Oxide, Phenoxyethanol, Methylparaben, EDTA 2Na, BHT, Fragrance
"
SPF,JP,Rotho Mentolatum ,Hada Labo White gel SPF 50,"Water, Ethylhexyl Methoxycinnamate, Isononyl Isononanoate, Dimethicone, Alcohol, Butylene Glycol, Peg-12 Dimethicone, Pentylene Glycol, Polysilicone-15, Glycol Dimethacrylate Crosspolymer, Bis-Ethylhexyloxyphenol Methoxyphenyl Triazine, Magnesium Ascorbyl Phosphate, Hydrolyzed Hyaluronic Acid, Sodium Hyaluronate, Diethylamino Hydroxybenzoyl Hexyl Benzoate, Polysilicone-13, Phenoxyethanol, Carbomer, Triethanolamine, Polystyrene, Polyvinyl Alcohol, Hydroxyethylcellulose, Disodium Edta, Iodopropynyl Butylcarbamate, Acrylates/​C10-30 Alkyl Acrylate Crosspolymer, Titanium Dioxide, Ammonium Acrylates Copolymer, Hydrated Silica, Aluminum Hydroxide, Hydrogen Dimethicone, Methylparaben
"
SPF,JP,Rotho Mentolatum ,Skin Aqua UV Super Moisture Essence Gold,"Water, Ethylhexyl Methoxycinnamate, Alcohol, Butylene Glycol, Diethylhexyl Succinate, Bisethylhexyloxyphenol Methoxyphenyl Triazine, Diethylamino Hydroxybenzoyl Hexyl Benzoate, Hydrolyzed Collagen, Arginine, Silica, Bis-PEG-18 Methyl Ether Dimethyl Silane, Methylene Bis-Benzotriazolyl Tetramethylbutylphenol, Triethylhexanoin, PEG-40 Glyceryl Stearate, Glycol Dimethacrylate Crosspolymer, Acrylates/​C10-30 Alkyl Acrylate Crosspolymer, Phenoxyethanol, Polysilicone-13, Triethanolamine, Decyl Glucoside, Xanthan Gum, Disodium EDTA, Polystyrene, Polyvinyl Alcohol, Polyglyceryl-10 Pentaisostearate, Propylene Glycol, Biosaccharide Gum-4, Glycerin
"
SPF,JP,Canmake,Mermaid SPF 50,"Water, Ethylhexyl Methoxycinnamate, Butylene Glycol, Diethylamino Hydroxybenzoyl Hexyl Benzoate, Zinc Oxide, Methylheptyl Laurate, Titanium Dioxide, Dimethicone, Bis-Ethylhexyloxyphenol Methoxyphenyl Triazine, Polymethylsilsesquioxane, Cyclopentasiloxane, Hydroxyethyl Acrylate/​Sodium Acryloyldimethyl Taurate Copolymer, Diisostearyl Malate, Aluminum Hydroxide, Peg-60 Hydrogenated Castor Oil, Stearic Acid, Phenoxyethanol, Polyglyceryl-3 Polydimethylsiloxyethyl Dimethicone, Polyhydroxystearic Acid, Jojoba Esters, Xanthan Gum, Arginine, Sodium Hyaluronate, Alpha-Glucan, Phytic Acid, Saxifraga Sarmentosa Extract, Glucosyl Ceramide, Prunus Yedoensis Leaf Extract, Coix Lacryma-Jobi (Job S Tears) Seed Extract, Morus Alba Root Extract, Oenothera Biennis Seed Extract, Silver Oxide, Spiraea Ulmaria Flower Extract, Vaccinium Myrtillus Leaf Extract, Cynara Scolymus (Artichoke) Leaf Extract"
SPF,JP,Rotho Mentolatum ,Skin Aqua UV Moisture Milk SPF 50,"Water, Cyclopentasiloxane, Zinc Oxide, Silica, Dimethicone, Triethoxysilylethyl Polydimethylsiloxyethyl Hexyl Dimethicone, Lauryl PEG-9 Polydimethylsiloxyethyl Dimethicone, Ethylhexyl Methoxycinnamate, Isononyl Isononanoate, Polymethylsilsesquioxane, Butylene Glycol, Diethylamino Hydroxybenzoyl Hexyl Benzoate, Acrylates/​Dimethicone Copolymer, Glycerin, Lauroyl Lysine, Methylparaben, Propylparaben, Disodium EDTA, Tocopheryl Acetate, Sodium Hyaluronate, Sodium Acetylated Hyaluronate, Panthenol, Dipotassium Glycyrrhizate, Hydrolyzed Collagen
"
SPF,KR,B Lab,Matcha SPF ,"Water, Dibutyl Adipate, Methylpropanediol, Alcohol Denat, Terephthalylidene Dicamphor Sulfonic Acid, 1,2-Hexanediol, Ethylhexyl Triazone, Glycerin, Niacinamide, Polysilicone-15, Tromethamine, Polyglyceryl-3 Distearate, Caprylyl Methicone, Cetearyl Alcohol, Diethylamino Hydroxybenzoyl Hexyl Benzoate, Dipropylene Glycol, Polymethylsilsesquioxane, Palmitic Acid, Stearic Acid, Bis-Ethylhexyloxyphenol Methoxyphenyl Triazine, Glyceryl Stearate, Potassium Cetyl Phosphate, Polyether-1, Carbomer, Ammonium Acryloyldimethyltaurate/​VP Copolymer, Glyceryl Stearate Citrate, Caprylic/​Capric Triglyceride, Acrylates/​C10-30 Alkyl Acrylate Crosspolymer, Camellia Sinensis Leaf Water (940 Ppm), Ethylhexylglycerin, Adenosine, Butylene Glycol, Menthyl Lactate, Ethyl Menthane Carboxamide, Methyl Diisopropyl Propionamide, Mesembryanthemum Crystallinum Extract, Pentylene Glycol, Caprylyl Glycol
"
SPF,KR,Mary & May,Cica Soothing SPF 50,"Water, Zinc Oxide, Cyclohexasiloxane, Butyloctyl Salicylate, Propanediol, Propylheptyl Caprylate, Polyglyceryl-3 Polydimethylsiloxyethyl Dimethicone, Isododecane, Caprylyl Methicone, Methyl Methacrylate Crosspolymer, Methyl Trimethicone, Disteardimonium Hectorite, Magnesium Sulfate, Triethoxycaprylylsilane, 1,2-Hexanediol, Polyglyceryl-2 Dipolyhydroxystearate, Polymethylsilsesquioxane, Lauryl Polyglyceryl-3 Polydimethylsiloxyethyl Dimethicone, Fragrance, Glyceryl Caprylate, Caprylyl Glycol, Ethylhexylglycerin, Sodium Hyaluronate, Tocopherol, Butylene Glycol, Centella Asiatica Extract, Centella Asiatica Root Extract, Saccharomyces Ferment, Centella Asiatica Leaf Extract, Propolis Extract, Asiaticoside, Madecassoside, Madecassic Acid, Asiatic Acid"
SPF,KR,COSRX,Aloe SPF 50,"Water, Ethylhexyl Methoxycinnamate, Glycerin, Propylene Glycol, Cyclopentasiloxane, Bis-Ethylhexyloxyphenol Methoxyphenyl Triazine, Phenylbenzimidazole Sulfonic Acid, Dicaprylyl Carbonate, Isoamyl P-Methoxycinnamate, Potassium Cetyl Phosphate, Alcohol, Dimethicone, Glyceryl Stearate, Butylene Glycol, Titanium Dioxide, C14-22 Alcohols, Polymethyl Methacrylate, Cetearyl Alcohol, Aloe Arborescens Leaf Extract, Dipotassium Glycyrrhizate, Tocopheryl Acetate, Peg-100 Stearate, Silica, C12-20 Alkyl Glucoside, Dimethicone/​Vinyl Dimethicone Crosspolymer, Aluminum Hydroxide, Stearic Acid, Caprylyl Glycol, Acrylates/​C10-30 Alkyl Acrylate Crosspolymer, Carbomer, Xanthan Gum, Triethanolamine, Sodium Hydroxide, Fragrance, Phenoxyethanol, Disodium Edta"
